{
  "schemaVersion": 1,
  "id": "ty-or-vy",
  "pair": "ru-en",
  "section": "phrases",
  "order": 1,
  "title": {
    "en": "Ты or вы"
  },
  "summary": {
    "en": "Two ways to say \"you\", and when to use each."
  },
  "body": {
    "en": "Russian has two words for \"you\".\n\n- **ты** is informal. Use it for a friend, family, a child, or someone your age you know well.\n- **вы** is formal, or plural. Use it for one person you respect or have just met, such as a boss, and for anyone speaking to two or more people.\n\nIn the show, Vika says **ты** to Max, as young people do. Max says **вы** to Chef Barinov, and a waiter says **вам** to a customer he does not know. When Barinov speaks to the whole kitchen, it is **вы** too.\n\nThe verb follows the word: **ты хочешь**, **вы хотите**. Other forms are **тебя**, **тебе** for ты, and **вас**, **вам** for вы.\n\nIf you are not sure, use **вы**. Switching to ты is usually offered by the other person."
  },
  "related": [
    "past-tense"
  ],
  "examples": [
    {
      "sceneId": "kukhnya-s01e01-scene-03",
      "seg": 5
    },
    {
      "sceneId": "kukhnya-s01e01-scene-11",
      "seg": 1
    },
    {
      "sceneId": "kukhnya-s01e03-scene-19",
      "seg": 6
    },
    {
      "sceneId": "kukhnya-s01e04-scene-06",
      "seg": 8
    }
  ],
  "tags": [
    "ты",
    "вы"
  ]
}
